{
  "schemaVersion": "1.0.0",
  "cardId": "CX-519",
  "worldId": "lingmai-ember-red-mist",
  "createdOn": "2026-08-03",
  "sourceAdoption": {
    "cardId": "CX-518",
    "path": "content/story/red-mist/red-mist-multiview-adoption.cx518.json",
    "sha256": "ddc479c41cb07b3bf2f833ab25870214d2b439f500e78a482dbe082ef44840c5",
    "expressionGenerationAllowed": true
  },
  "generationPolicy": {
    "imageProvider": "codex_builtin_imagegen",
    "stillImagesOnly": true,
    "generationCalls": 24,
    "successfulOutputs": 19,
    "failedCalls": 5,
    "discardedOutputs": 1,
    "compositeBoardFiles": 18,
    "independentExpressionFiles": 72,
    "cropMethod": "ffmpeg_crop_756x504_lanczos_to_1536x1024",
    "overwriteExistingAssets": false,
    "runtimeUse": false,
    "shipInBuild": false,
    "videoOrAudioUsed": false,
    "flow2ApiUsed": false,
    "geminiUsed": false,
    "veoUsed": false,
    "cx514Status": "paused"
  },
  "emotionOrder": [
    "neutral",
    "calm_warmth",
    "restrained_joy",
    "resolve",
    "vigilance",
    "suspicion",
    "concern",
    "grief",
    "anger_controlled",
    "fear_suppressed",
    "pain",
    "astonishment"
  ],
  "groupDefinitions": [
    {
      "group": "a",
      "emotions": [
        "neutral",
        "calm_warmth",
        "restrained_joy",
        "resolve"
      ],
      "quadrants": [
        "top_left",
        "top_right",
        "bottom_left",
        "bottom_right"
      ]
    },
    {
      "group": "b",
      "emotions": [
        "vigilance",
        "suspicion",
        "concern",
        "grief"
      ],
      "quadrants": [
        "top_left",
        "top_right",
        "bottom_left",
        "bottom_right"
      ]
    },
    {
      "group": "c",
      "emotions": [
        "anger_controlled",
        "fear_suppressed",
        "pain",
        "astonishment"
      ],
      "quadrants": [
        "top_left",
        "top_right",
        "bottom_left",
        "bottom_right"
      ]
    }
  ],
  "subjects": [
    {
      "subjectId": "character.shen_yan",
      "slug": "shen_yan",
      "identityAnchor": {
        "assetId": "identity.shen_yan.v1",
        "path": "content/visual-candidates/cx508/identity-anchors/identity_shen_yan_v1.png",
        "sha256": "1a0973205fac132f1f5d3c658f8921200d5ce4ca7575182a2c85ab80eb166e50"
      },
      "outfitReference": {
        "assetId": "turnaround.outfit.shen_yan_qinglan_travel.v1",
        "path": "content/visual-candidates/cx517/turnarounds/turnaround_outfit_shen_yan_qinglan_travel_v1.png",
        "sha256": "48548c9b77e9e6b1225f29bda1686bb1c00ffb3c6707f92325f055a1fef481fe"
      },
      "boards": [
        {
          "assetId": "expression_board.shen_yan.group_a.v1",
          "group": "a",
          "emotions": [
            "neutral",
            "calm_warmth",
            "restrained_joy",
            "resolve"
          ],
          "outputPath": "content/visual-candidates/cx519/expression-boards/expression_board_shen_yan_group_a_v1.png",
          "generationMode": "codex_builtin_imagegen",
          "prompt": "Preserve the exact fictional identity, age, face, hair, outfit neckline, 85mm straight-on head-and-shoulders framing, high-key warm-ivory studio light and precise 2x2 layout for character.shen_yan. Change facial muscles only for the ordered expressions neutral, calm_warmth, restrained_joy, resolve. Keep natural pores, realistic eyelids, wet eye highlights and physical cloth. No text, labels, watermark, hands, props or extra people. No actor likeness. Avoid identity drift, age drift, clothing drift, malformed or crossed eyes, waxy skin, visible teeth, tears, injury and theatrical gestures.",
          "adoptionStatus": "needs_review",
          "adopted": false,
          "runtimeUse": false,
          "shipInBuild": false,
          "artifact": {
            "mediaType": "image/png",
            "byteLength": 2208985,
            "width": 1536,
            "height": 1024,
            "sha256": "f469de691bf78fc5fc3aea902ad8ff8af0f41b399eb773daefb06fd3f8e663b8"
          }
        },
        {
          "assetId": "expression_board.shen_yan.group_b.v1",
          "group": "b",
          "emotions": [
            "vigilance",
            "suspicion",
            "concern",
            "grief"
          ],
          "outputPath": "content/visual-candidates/cx519/expression-boards/expression_board_shen_yan_group_b_v1.png",
          "generationMode": "codex_builtin_imagegen",
          "prompt": "Preserve the exact fictional identity, age, face, hair, outfit neckline, 85mm straight-on head-and-shoulders framing, high-key warm-ivory studio light and precise 2x2 layout for character.shen_yan. Change facial muscles only for the ordered expressions vigilance, suspicion, concern, grief. Keep natural pores, realistic eyelids, wet eye highlights and physical cloth. No text, labels, watermark, hands, props or extra people. No actor likeness. Avoid identity drift, age drift, clothing drift, malformed or crossed eyes, waxy skin, visible teeth, tears, injury and theatrical gestures.",
          "adoptionStatus": "needs_review",
          "adopted": false,
          "runtimeUse": false,
          "shipInBuild": false,
          "artifact": {
            "mediaType": "image/png",
            "byteLength": 2137954,
            "width": 1536,
            "height": 1024,
            "sha256": "9a2e3c5905cd698d5e58e2808a9446a38f46514e7b0cb40a40a6bedb82b03c96"
          }
        },
        {
          "assetId": "expression_board.shen_yan.group_c.v1",
          "group": "c",
          "emotions": [
            "anger_controlled",
            "fear_suppressed",
            "pain",
            "astonishment"
          ],
          "outputPath": "content/visual-candidates/cx519/expression-boards/expression_board_shen_yan_group_c_v1.png",
          "generationMode": "codex_builtin_imagegen",
          "prompt": "Preserve the exact fictional identity, age, face, hair, outfit neckline, 85mm straight-on head-and-shoulders framing, high-key warm-ivory studio light and precise 2x2 layout for character.shen_yan. Change facial muscles only for the ordered expressions anger_controlled, fear_suppressed, pain, astonishment. Keep natural pores, realistic eyelids, wet eye highlights and physical cloth. No text, labels, watermark, hands, props or extra people. No actor likeness. Avoid identity drift, age drift, clothing drift, malformed or crossed eyes, waxy skin, visible teeth, tears, injury and theatrical gestures.",
          "adoptionStatus": "needs_review",
          "adopted": false,
          "runtimeUse": false,
          "shipInBuild": false,
          "artifact": {
            "mediaType": "image/png",
            "byteLength": 2153028,
            "width": 1536,
            "height": 1024,
            "sha256": "4386362d5c521ad8a6f7b262c7b54a54f3b09f87637320107fc64912223c4fc1"
          }
        }
      ],
      "expressions": [
        {
          "assetId": "expression.shen_yan.neutral.v1",
          "emotionId": "neutral",
          "outputPath": "content/visual-candidates/cx519/expressions/expression_shen_yan_neutral_v1.png",
          "sourceBoardPath": "content/visual-candidates/cx519/expression-boards/expression_board_shen_yan_group_a_v1.png",
          "sourceGroup": "a",
          "sourceQuadrant": "top_left",
          "crop": {
            "x": 6,
            "y": 4,
            "width": 756,
            "height": 504,
            "scaleWidth": 1536,
            "scaleHeight": 1024,
            "filter": "lanczos"
          },
          "generationMode": "deterministic_ffmpeg_crop",
          "adoptionStatus": "needs_review",
          "adopted": false,
          "runtimeUse": false,
          "shipInBuild": false,
          "reviewStatus": "pending_human_review",
          "reviewChecks": [
            "identity_consistency",
            "expression_readability",
            "eye_anatomy",
            "skin_texture",
            "neckline_consistency",
            "no_text_or_watermark",
            "no_actor_likeness"
          ],
          "artifact": {
            "mediaType": "image/png",
            "byteLength": 1441974,
            "width": 1536,
            "height": 1024,
            "sha256": "70fc16919076ed5208a2306b14c729e627efff01310422e79e8e75473562eef1"
          }
        },
        {
          "assetId": "expression.shen_yan.calm_warmth.v1",
          "emotionId": "calm_warmth",
          "outputPath": "content/visual-candidates/cx519/expressions/expression_shen_yan_calm_warmth_v1.png",
          "sourceBoardPath": "content/visual-candidates/cx519/expression-boards/expression_board_shen_yan_group_a_v1.png",
          "sourceGroup": "a",
          "sourceQuadrant": "top_right",
          "crop": {
            "x": 774,
            "y": 4,
            "width": 756,
            "height": 504,
            "scaleWidth": 1536,
            "scaleHeight": 1024,
            "filter": "lanczos"
          },
          "generationMode": "deterministic_ffmpeg_crop",
          "adoptionStatus": "needs_review",
          "adopted": false,
          "runtimeUse": false,
          "shipInBuild": false,
          "reviewStatus": "pending_human_review",
          "reviewChecks": [
            "identity_consistency",
            "expression_readability",
            "eye_anatomy",
            "skin_texture",
            "neckline_consistency",
            "no_text_or_watermark",
            "no_actor_likeness"
          ],
          "artifact": {
            "mediaType": "image/png",
            "byteLength": 1440172,
            "width": 1536,
            "height": 1024,
            "sha256": "4bd97c2bdbb1661119871ae0704ed7366e415f9f1d88606d2d03dc589afccfaa"
          }
        },
        {
          "assetId": "expression.shen_yan.restrained_joy.v1",
          "emotionId": "restrained_joy",
          "outputPath": "content/visual-candidates/cx519/expressions/expression_shen_yan_restrained_joy_v1.png",